{
  "meals": [
    {
      "day": "Monday",
      "meal": "Crockpot Crack Chicken over Rice",
      "style": "Crockpot"
    },
    {
      "day": "Tuesday",
      "meal": "Chicken Burrito Bowls",
      "style": "Rice bowl / Mexican"
    },
    {
      "day": "Wednesday",
      "meal": "GF Fettuccine Alfredo with Garlic Butter Broccoli",
      "style": "Pasta"
    },
    {
      "day": "Thursday",
      "meal": "Honey Garlic Salmon with Steamed Green Beans",
      "style": "Pan sear"
    },
    {
      "day": "Friday",
      "meal": "Crockpot Chicken Tortilla Soup (corn chips)",
      "style": "Crockpot / Mexican"
    },
    {
      "day": "Saturday",
      "meal": "Crockpot Salsa Verde Chicken Tacos (corn tortillas)",
      "style": "Crockpot / Mexican"
    },
    {
      "day": "Sunday",
      "meal": "Teriyaki Chicken Rice Bowls",
      "style": "Rice bowl"
    }
  ],
  "recipes": [
    {
      "day": "Monday",
      "name": "Crockpot Crack Chicken over Rice",
      "ingredients": [
        "1 lb boneless skinless chicken thighs",
        "1/2 oz ranch seasoning (half packet)",
        "8 oz cream cheese",
        "4 slices bacon, cooked and chopped",
        "3/4 cup shredded cheddar",
        "1/4 cup sliced green onions",
        "1 cup white rice"
      ],
      "instructions": "Slow cooker LOW 7 hrs. Shred, stir, top with cheddar, melt 10 min. Serve over rice.",
      "prepSteps": [
        "Morning (5 min): Place chicken thighs in slow cooker in a single layer. Sprinkle ranch seasoning evenly over chicken. Cut cream cheese into cubes and place on top.",
        "Set and forget: Cover and cook on LOW for 6-7 hours (or HIGH for 3-4 hours).",
        "Before serving (10 min): Use two forks to shred chicken directly in the slow cooker. Stir to combine shredded chicken with the cream cheese sauce.",
        "Melt toppings: Sprinkle bacon and cheddar cheese over the top. Cover and let sit 5 minutes until cheese melts.",
        "Rice: Start rice 20-30 minutes before serving (or use instant rice).",
        "Serve: Spoon crack chicken over rice. Garnish with sliced green onions."
      ],
      "tips": [
        "Cook bacon ahead of time or use pre-cooked bacon to save time",
        "Chicken breasts work but thighs stay more tender",
        "Leftovers reheat well — add a splash of milk if sauce thickens"
      ]
    },
    {
      "day": "Tuesday",
      "name": "Chicken Burrito Bowls",
      "ingredients": [
        "1 lb chicken breast, diced",
        "1 Tbsp olive oil, 1 tsp cumin, 1 tsp chili powder, 1/2 tsp garlic powder, salt & pepper",
        "1 cup rice",
        "1 can (15 oz) black beans, drained",
        "1/2 cup corn (frozen or canned)",
        "1/2 cup salsa, 1/4 cup sour cream",
        "Toppings: shredded cheese, avocado, cilantro"
      ],
      "instructions": "Season and saute chicken 6-7 min. Serve over rice with beans, corn, and toppings.",
      "prepSteps": [
        "Start rice: Begin cooking rice according to package directions (about 20 min).",
        "Prep chicken: Dice chicken breast into bite-sized cubes. Season with cumin, chili powder, garlic powder, salt, and pepper.",
        "Cook chicken: Heat olive oil in a large skillet over medium-high heat. Add chicken and cook 6-7 minutes, stirring occasionally, until cooked through and slightly charred.",
        "Prep toppings: While chicken cooks, drain and rinse black beans, warm corn, dice avocado, chop cilantro.",
        "Assemble bowls: Divide rice among bowls. Top with chicken, black beans, corn, salsa, sour cream, cheese, avocado, and cilantro."
      ],
      "tips": [
        "Cut chicken into even-sized pieces for consistent cooking",
        "For extra flavor, cook black beans with a little cumin",
        "Add a squeeze of lime juice for brightness"
      ]
    },
    {
      "day": "Wednesday",
      "name": "GF Fettuccine Alfredo with Broccoli",
      "ingredients": [
        "9 oz GF fettuccine",
        "2 Tbsp butter, 1 cup heavy cream, 1 clove garlic minced",
        "3/4 cup grated Parmesan, salt & pepper",
        "2 cups broccoli florets"
      ],
      "instructions": "Melt butter, saute garlic 30 sec, add cream, simmer 3 min. Stir in Parmesan until smooth. Toss with cooked GF pasta. Steam or roast broccoli on the side.",
      "prepSteps": [
        "Boil water: Bring a large pot of salted water to boil for pasta.",
        "Prep broccoli: Cut broccoli into florets. Either steam (5 min) or roast at 425F with olive oil, salt, pepper (15 min).",
        "Cook pasta: Add GF fettuccine to boiling water. Cook according to package directions. Reserve 1/2 cup pasta water before draining.",
        "Make sauce: While pasta cooks, melt butter in a large pan over medium heat. Add minced garlic, saute 30 seconds until fragrant. Pour in heavy cream, bring to a gentle simmer for 3 minutes.",
        "Finish sauce: Remove pan from heat. Stir in grated Parmesan until melted and smooth. Season with salt and pepper.",
        "Combine: Toss drained pasta with sauce. Add splash of pasta water if too thick. Serve immediately with broccoli on the side."
      ],
      "tips": [
        "Don't boil the cream — keep it at a gentle simmer to prevent separating",
        "Freshly grated Parmesan melts better than pre-shredded",
        "GF pasta can get gummy — don't overcook, taste test early"
      ]
    },
    {
      "day": "Thursday",
      "name": "Honey Garlic Salmon with Steamed Green Beans",
      "ingredients": [
        "3 salmon fillets (~5 oz each)",
        "2 Tbsp honey, 1 Tbsp tamari/GF soy sauce, 1 tsp minced garlic, 1 Tbsp butter",
        "12 oz green beans, salt & pepper"
      ],
      "instructions": "Sear salmon skin-side up 3 min, flip, add honey-garlic-tamari sauce, cook 3 more min basting. Steam green beans on the side.",
      "prepSteps": [
        "Prep salmon: Pat salmon fillets dry with paper towels. Season both sides with salt and pepper. Let sit at room temperature 10 min.",
        "Make sauce: Mix honey, tamari, and minced garlic in a small bowl.",
        "Prep green beans: Trim ends from green beans. Set up steamer basket over simmering water.",
        "Sear salmon: Heat a large skillet over medium-high heat. Add a little oil. Place salmon skin-side up, sear 3 minutes until golden crust forms.",
        "Add sauce: Flip salmon (skin-side down now). Pour sauce around fish. Add butter. Cook 3-4 more minutes, spooning sauce over salmon repeatedly.",
        "Steam beans: Steam green beans 5-6 minutes until tender-crisp. Season with salt and pepper.",
        "Serve: Plate salmon with green beans. Drizzle remaining pan sauce over fish."
      ],
      "tips": [
        "Pat salmon very dry for the best sear",
        "Don't move the fish while searing — let the crust develop",
        "Salmon is done when it flakes easily with a fork"
      ]
    },
    {
      "day": "Friday",
      "name": "Crockpot Chicken Tortilla Soup",
      "ingredients": [
        "1 lb chicken breast",
        "1 can (14 oz) diced tomatoes, 1 can (15 oz) black beans (drained), 1 cup corn",
        "1 cup chicken broth, 1 tsp cumin, 1 tsp chili powder, 1/2 tsp garlic powder, salt",
        "Toppings: corn tortilla chips, shredded cheese, sour cream, avocado, cilantro, lime"
      ],
      "instructions": "Place chicken, tomatoes, beans, corn, broth, and spices in slow cooker. Cook LOW 6-8 hrs. Shred chicken, stir. Serve with toppings.",
      "prepSteps": [
        "Morning (10 min): Add chicken breasts to slow cooker. Pour in diced tomatoes (with juice), drained black beans, and corn.",
        "Add liquids and seasoning: Pour in chicken broth. Add cumin, chili powder, garlic powder, and salt. Stir gently to combine.",
        "Cook: Cover and cook on LOW for 6-8 hours or HIGH for 3-4 hours.",
        "Shred chicken: Remove chicken breasts, shred with two forks, return to pot. Stir to combine.",
        "Prep toppings: Dice avocado, chop cilantro, cut lime into wedges, set out tortilla chips and other toppings.",
        "Serve: Ladle soup into bowls. Top with crushed tortilla chips, cheese, sour cream, avocado, cilantro, and a squeeze of lime."
      ],
      "tips": [
        "For thicker soup, mash some of the beans before adding",
        "Crush chips right before serving so they stay crunchy",
        "Freezes well — store without toppings"
      ]
    },
    {
      "day": "Saturday",
      "name": "Crockpot Salsa Verde Chicken Tacos",
      "ingredients": [
        "1 lb boneless skinless chicken breast",
        "1 cup salsa verde",
        "1 tsp cumin, 1/2 tsp garlic powder, salt",
        "Corn tortillas (GF)",
        "Toppings: diced onion, cilantro, lime, shredded cheese, sour cream"
      ],
      "instructions": "Place chicken in slow cooker, pour salsa verde, season. Cook LOW 6 hrs. Shred and serve in corn tortillas.",
      "prepSteps": [
        "Morning (5 min): Place chicken breasts in slow cooker. Pour salsa verde over chicken. Sprinkle with cumin, garlic powder, and salt.",
        "Cook: Cover and cook on LOW for 6 hours or HIGH for 3 hours.",
        "Shred: Remove chicken and shred with two forks. Return to slow cooker and stir into the salsa verde sauce.",
        "Warm tortillas: Heat corn tortillas in a dry skillet 30 seconds per side, or wrap in damp paper towel and microwave 30 seconds.",
        "Prep toppings: Dice onion, chop cilantro, cut lime into wedges.",
        "Assemble tacos: Fill warmed tortillas with shredded chicken. Top with onion, cilantro, cheese, sour cream, and a squeeze of lime."
      ],
      "tips": [
        "Double wrap corn tortillas for sturdier tacos",
        "Chicken thighs also work well and stay very moist",
        "Great for taco salad bowls too — serve over lettuce"
      ]
    },
    {
      "day": "Sunday",
      "name": "Teriyaki Chicken Rice Bowls",
      "ingredients": [
        "1 lb chicken thighs, sliced",